{"schema_version":1,"mode":"demo","generated_utc":"2026-10-19T12:00:00Z","as_of_utc":"2026-10-19T12:00:00Z","source":"demo-generator","mt5":{"status":"DISCONNECTED","mode":"history-only (planned)","server":null,"last_check_utc":"2026-10-19T11:58:25Z","note":"No terminal attached. This build never sends orders; MT5 will only be used to download quote history."},"feeds":[{"symbol":"XAUUSD","ticks_per_s":1.6,"last_tick_age_s":0.7,"gap_share":0.004,"spread_median_pips":24.48,"spread_quality":"PASS","status":"HEALTHY"},{"symbol":"EURUSD","ticks_per_s":1.9,"last_tick_age_s":0.6,"gap_share":0.0051,"spread_median_pips":0.71,"spread_quality":"PASS","status":"HEALTHY"},{"symbol":"GBPUSD","ticks_per_s":2.2,"last_tick_age_s":1.4,"gap_share":0.0046,"spread_median_pips":0.95,"spread_quality":"PASS","status":"HEALTHY"},{"symbol":"GBPJPY","ticks_per_s":2.7,"last_tick_age_s":1.9,"gap_share":0.0033,"spread_median_pips":1.46,"spread_quality":"WARN","status":"HEALTHY"}],"ci":[{"workflow":"safety (ubuntu-latest)","status":"success","branch":"develop","commit":"d14037c","finished_utc":"2026-10-19T10:00:00Z","duration_s":41},{"workflow":"safety (windows-latest)","status":"success","branch":"develop","commit":"d14037c","finished_utc":"2026-10-19T10:00:50Z","duration_s":78},{"workflow":"baseline-guard","status":"success","branch":"develop","commit":"d14037c","finished_utc":"2026-10-19T10:01:40Z","duration_s":22},{"workflow":"legacy-tests (windows)","status":"failure","branch":"develop","commit":"d14037c","finished_utc":"2026-10-19T10:05:00Z","duration_s":95},{"workflow":"audit-tests v7.3.1","status":"running","branch":"audit/v731","commit":"a91c3e2","finished_utc":null,"duration_s":null},{"workflow":"dashboard-contracts","status":"pending","branch":"feat/command-center","commit":"b72f410","finished_utc":null,"duration_s":null}],"versions":[{"component":"Engine baseline","version":"V7.2.1","state":"FROZEN"},{"component":"Simulator","version":"V7.3.1","state":"PROPOSAL"},{"component":"Research package","version":"0.1","state":"PROPOSAL"},{"component":"Command Center","version":"1.0.0","state":"DEMO DATA"},{"component":"Data contracts","version":"schema v1","state":"STABLE"}],"validation":{"status":"WAIT","reasons":["No candidate passed FDR-controlled validation (0 of 10 demo strategies, 0 of 144 in the V7.2 family)","Spread-cost hurdle exceeds any measured gross edge","Forward DEMO evidence not started","Broker clock offset and real spreads not yet measured"]},"logs":[{"t_utc":"2026-10-19T11:59:55Z","level":"INFO","source":"feed","msg":"demo replay tick accepted (4 symbols)"},{"t_utc":"2026-10-19T11:59:29Z","level":"INFO","source":"agents","msg":"heartbeat ok: 5/5 agents"},{"t_utc":"2026-10-19T11:58:25Z","level":"WARN","source":"mt5","msg":"terminal not connected: running on synthetic data"},{"t_utc":"2026-10-19T11:57:00Z","level":"INFO","source":"engine","msg":"baseline V7.2.1 frozen; simulator V7.3.1 proposal loaded"},{"t_utc":"2026-10-19T11:55:40Z","level":"INFO","source":"feed","msg":"gap check: max gap 4.1 s (limit 5 s)"},{"t_utc":"2026-10-19T11:52:00Z","level":"WARN","source":"feed","msg":"GBPJPY spread above its 1.35x baseline"},{"t_utc":"2026-10-19T11:49:20Z","level":"ERROR","source":"ci","msg":"windows legacy-tests job failed on pandas 3.0 (known baseline result, not edited)"},{"t_utc":"2026-10-19T11:48:20Z","level":"INFO","source":"ci","msg":"safety scanner: 0 findings (report mode)"},{"t_utc":"2026-10-19T11:35:00Z","level":"INFO","source":"risk","msg":"kill switch engaged: live trading disabled"},{"t_utc":"2026-10-19T11:25:00Z","level":"WARN","source":"engine","msg":"validation verdict WAIT: no candidate passed FDR"},{"t_utc":"2026-10-19T11:05:00Z","level":"INFO","source":"lab","msg":"candidate table exported: 10 strategies"},{"t_utc":"2026-10-19T10:33:20Z","level":"INFO","source":"feed","msg":"session change: London open"},{"t_utc":"2026-10-19T10:03:20Z","level":"WARN","source":"agents","msg":"Strategy Evaluator idle > 60 min"},{"t_utc":"2026-10-19T09:30:00Z","level":"INFO","source":"system","msg":"command center demo data generated (deterministic)"}],"safety":{"trading_enabled":false,"live_orders":0,"kill_switch":"ENGAGED"}}
